{ 
  "description" : "",
  "data_type" : "int32",
  "dimensions" : { "n_rows": 444, "n_cols": 444 },
  "margins" : { "nm" : null, "px" : 0 },
  "sampling_rate" : { "x_nm_per_pixel" : 0.00009, 
  "y_nm_per_pixel" : 0.00009
  },
  "roi_rectangle" : { "x": 1, "y": 2, "n_rows": 1, "n_cols": 2, "center_x" :0 , "center_y" : 0 },
  "image_statistical" : { "mean" : [1], "stddev" : [1] }
}